<?xml version="1.0" encoding="ISO-8859-1"?>
<AUTO xsi:noNamespaceSchemaLocation="kfz.xsd" xmlns:xsi="http://www.w3.org/2001/XMLSchema-instance">
	<KFZ>
		<HERSTELLER>BMW</HERSTELLER>
		<MODELL>BMW Z8</MODELL>
		<LEERGEWICHT einheit="kg">1690</LEERGEWICHT>
		<ZYLINDER>8</ZYLINDER>
		<HUBRAUM einheit="ccm">4941</HUBRAUM>
		<LEISTUNG einheit="kW">294</LEISTUNG>
		<HOECHSTGESCHWINDIGKEIT einheit="kmh">250</HOECHSTGESCHWINDIGKEIT>
		<VON0AUF100 einheit="s">4.7</VON0AUF100>
	</KFZ>
	<KFZ>
		<HERSTELLER>MERCEDES</HERSTELLER>
		<MODELL>SLK 32 AMG</MODELL>
		<LEERGEWICHT einheit="kg">1495</LEERGEWICHT>
		<ZYLINDER>6</ZYLINDER>
		<HUBRAUM einheit="ccm">3199</HUBRAUM>
		<LEISTUNG einheit="kW">260</LEISTUNG>
		<HOECHSTGESCHWINDIGKEIT einheit="kmh">250</HOECHSTGESCHWINDIGKEIT>
		<VON0AUF100 einheit="s">5.2</VON0AUF100>
	</KFZ>
	<KFZ>
		<HERSTELLER>AUDI</HERSTELLER>
		<MODELL>1.8 T quattro</MODELL>
		<LEERGEWICHT einheit="kg">1395</LEERGEWICHT>
		<ZYLINDER>4</ZYLINDER>
		<HUBRAUM einheit="ccm">1781</HUBRAUM>
		<LEISTUNG einheit="kW">165</LEISTUNG>
		<HOECHSTGESCHWINDIGKEIT einheit="kmh">243</HOECHSTGESCHWINDIGKEIT>
		<VON0AUF100 einheit="s">6.4</VON0AUF100>
	</KFZ>
</AUTO>
